{
  "$schema": "http://json-schema.org/draft-07/schema#",
  "type": "object",
  "properties": {
    "id": {
      "type": [
        "null",
        "string"
      ]
    },
    "estimate_status": {
      "type": [
        "null",
        "string"
      ]
    },
    "acceptance_status": {
      "type": [
        "null",
        "string"
      ]
    },
    "customer_id": {
      "type": [
        "null",
        "string"
      ]
    },
    "tradename_id": {
      "type": [
        "null",
        "string"
      ]
    },
    "estimate_number": {
      "type": [
        "null",
        "string"
      ]
    },
    "valid_until": {
      "type": [
        "null",
        "string"
      ],
      "format": "date"
    },
    "total": {
      "type": [
        "null",
        "object"
      ],
      "properties": {
        "amount": {
          "type": [
            "null",
            "string"
          ]
        },
        "currency": {
          "type": [
            "null",
            "string"
          ]
        }
      }
    },
    "total_incl_vat": {
      "type": [
        "null",
        "object"
      ],
      "properties": {
        "amount": {
          "type": [
            "null",
            "string"
          ]
        },
        "currency": {
          "type": [
            "null",
            "string"
          ]
        }
      }
    },
    "net_amounts": {
      "type": [
        "null",
        "boolean"
      ]
    },
    "introduction": {
      "type": [
        "null",
        "string"
      ]
    },
    "remarks": {
      "type": [
        "null",
        "string"
      ]
    },
    "reference": {
      "type": [
        "null",
        "string"
      ]
    },
    "customer_company_name": {
      "type": [
        "null",
        "string"
      ]
    },
    "customer_attn": {
      "type": [
        "null",
        "string"
      ]
    },
    "customer_address_street": {
      "type": [
        "null",
        "string"
      ]
    },
    "customer_address_city": {
      "type": [
        "null",
        "string"
      ]
    },
    "customer_address_postal_code": {
      "type": [
        "null",
        "string"
      ]
    },
    "customer_address_country_code": {
      "type": [
        "null",
        "string"
      ]
    },
    "customer_address_country_name": {
      "type": [
        "null",
        "string"
      ]
    },
    "customer_address_extra_information": {
      "type": [
        "null",
        "string"
      ]
    },
    "customer_vat_shifted": {
      "type": [
        "null",
        "boolean"
      ]
    },
    "customer_vat_number": {
      "type": [
        "null",
        "string"
      ]
    },
    "language": {
      "type": [
        "null",
        "string"
      ]
    },
    "line_items": {
      "type": [
        "null",
        "array"
      ],
      "items": {
        "type": [
          "null",
          "object"
        ],
        "properties": {
          "description": {
            "type": [
              "null",
              "string"
            ]
          },
          "vat": {
            "type": [
              "null",
              "object"
            ],
            "properties": {
              "value": {
                "type": [
                  "null",
                  "number"
                ]
              },
              "category": {
                "type": [
                  "null",
                  "string"
                ]
              }
            }
          },
          "quantity": {
            "type": [
              "null",
              "string",
              "number",
              "integer"
            ]
          },
          "amount": {
            "type": [
              "null",
              "object"
            ],
            "properties": {
              "amount": {
                "type": [
                  "null",
                  "string"
                ]
              },
              "currency": {
                "type": [
                  "null",
                  "string"
                ]
              }
            }
          },
          "total_amount_ex_vat": {
            "type": [
              "null",
              "object"
            ],
            "properties": {
              "amount": {
                "type": [
                  "null",
                  "string"
                ]
              },
              "currency": {
                "type": [
                  "null",
                  "string"
                ]
              }
            }
          }
        }
      }
    },
    "discounts": {
      "type": [
        "null",
        "array"
      ],
      "items": {
        "type": [
          "null",
          "object"
        ],
        "properties": {
          "description": {
            "type": [
              "null",
              "string"
            ]
          },
          "percentage": {
            "type": [
              "null",
              "integer"
            ]
          }
        }
      }
    },
    "sent_or_modified_on": {
      "type": [
        "null",
        "string"
      ],
      "format": "date"
    },
    "attachments": {
      "type": [
        "null",
        "array"
      ],
      "items": {
        "type": [
          "null",
          "object"
        ],
        "properties": {
          "id": {
            "type": [
              "null",
              "string"
            ]
          },
          "name": {
            "type": [
              "null",
              "string"
            ]
          }
        }
      }
    }
  }
}
